{
  "id": "less-comments-comments2",
  "title": "Fix Less parity for comments / comments2",
  "track": "less-registry-redesign",
  "bucket": "less-fixture",
  "priority": "p1",
  "status": "superseded",
  "source_refs": [
    "docs/future/performance/2026-04-13-registry-redesign-proposal.md",
    "packages/jess/test/less/all-less.test.ts",
    "tests-unit/comments/comments2.less",
    "state/codex-auto/results/all-less.latest.log",
    "state/codex-auto/runs/less-comments-comments2-20260422-125639/summary.json"
  ],
  "goal_refs": [
    "less parity recovery",
    "split evaluated-source trivia work away from the broad fixture bucket"
  ],
  "depends_on": [
    "less-comments2-eval-source-trivia"
  ],
  "blocked_by": [],
  "definition_of_done": "This parent task stays superseded once the concrete comments2 subtask is tracked canonically.",
  "proof_expectations": [
    "subtask recorded with concrete proof expectations"
  ],
  "accepted_commit": null,
  "accepted_run_id": null,
  "last_transition_event_id": "operator:task-superseded:less-comments-comments2:1776890402000"
}
