{
  "id": "less-comments-selector-comment-trivia",
  "title": "Preserve selector and at-rule header comments in comments.less",
  "track": "less-registry-redesign",
  "bucket": "less-fixture",
  "priority": "p1",
  "status": "superseded",
  "source_refs": [
    "tests-unit/comments/comments.less",
    "state/codex-auto/results/all-less.latest.log",
    "state/codex-auto/runs/less-comments-20260422-124515/summary.json",
    "state/codex-auto/runs/less-comments-selector-comment-trivia-20260422-141731/summary.json",
    "docs/future/performance/2026-04-13-registry-redesign-handoff.md"
  ],
  "goal_refs": [
    "less parity recovery",
    "split remaining selector/header and frame-comment work into narrower fixable slices"
  ],
  "depends_on": [
    "less-comments-selector-header-trivia",
    "less-comments-frame-post-trivia"
  ],
  "blocked_by": [],
  "definition_of_done": "This parent task stays superseded once the narrower selector/header and frame-comment subtasks are tracked canonically.",
  "proof_expectations": [
    "subtasks recorded with concrete proof expectations"
  ],
  "accepted_commit": null,
  "accepted_run_id": null,
  "last_transition_event_id": "operator:task-superseded:less-comments-selector-comment-trivia:1776894255000"
}
