{
  "id": "less-css-grid",
  "title": "Fix Less parity for css grid / css grid",
  "track": "less-registry-redesign",
  "bucket": "less-fixture",
  "priority": "p1",
  "status": "completed",
  "source_refs": [
    "docs/future/performance/2026-04-13-registry-redesign-proposal.md",
    "packages/jess/test/less/all-less.test.ts",
    "tests-unit/css-grid/css-grid.less",
    "state/codex-auto/results/all-less.latest.log"
  ],
  "goal_refs": [
    "less parity recovery"
  ],
  "depends_on": [],
  "blocked_by": [],
  "definition_of_done": "Focused proof and targeted outer proof both pass, and accepted evidence is linked.",
  "proof_expectations": [
    "targeted core or parser repro when applicable",
    "targeted less fixture proof",
    "promotion verification"
  ],
  "accepted_commit": "96984a0ea751ae4a0a295296b90a8fddb4b835c4",
  "accepted_run_id": null,
  "last_transition_event_id": "simple-loop:finish:less-css-grid:1777683342842"
}
