{
  "id": "less-css-3",
  "title": "Fix Less parity for css 3 / css 3",
  "track": "less-registry-redesign",
  "bucket": "less-fixture",
  "priority": "p1",
  "status": "open",
  "source_refs": [
    "docs/future/performance/2026-04-13-registry-redesign-proposal.md",
    "packages/jess/test/less/all-less.test.ts",
    "tests-unit/css-3/css-3.less",
    "state/codex-auto/results/all-less.latest.log"
  ],
  "goal_refs": [
    "less parity recovery"
  ],
  "depends_on": [],
  "blocked_by": [],
  "definition_of_done": "Focused proof and targeted outer proof both pass, and accepted evidence is linked.",
  "proof_expectations": [
    "targeted core or parser repro when applicable",
    "targeted less fixture proof",
    "promotion verification"
  ],
  "accepted_commit": null,
  "accepted_run_id": null,
  "last_transition_event_id": null
}
