{
  "id": "less-at-rules-comments",
  "title": "Preserve authored comments in at-rule preludes",
  "track": "less-registry-redesign",
  "bucket": "less-fixture",
  "priority": "p1",
  "status": "completed",
  "source_refs": [
    "docs/future/performance/2026-04-13-registry-redesign-proposal.md",
    "packages/jess/test/less/all-less.test.ts"
  ],
  "goal_refs": [
    "docs/superpowers/specs/2026-04-20-durable-task-memory-design.md"
  ],
  "depends_on": [],
  "blocked_by": [],
  "definition_of_done": "Focused proof and targeted outer proof both pass, and accepted evidence is linked.",
  "proof_expectations": [
    "targeted core or parser repro when applicable",
    "targeted less fixture proof",
    "promotion verification"
  ],
  "accepted_commit": "fc27b0ed13c7c887b9435989d34bf0e088961b12",
  "accepted_run_id": "less-at-rules-comments-20260422-113144",
  "last_transition_event_id": "less-at-rules-comments-20260422-113144:task-transition:completed:1776883649"
}
