{
  "id": "less-comments-selector-header-trivia",
  "title": "Preserve selector and at-rule header comments in comments.less",
  "track": "less-registry-redesign",
  "bucket": "less-fixture",
  "priority": "p1",
  "status": "open",
  "source_refs": [
    "tests-unit/comments/comments.less",
    "state/codex-auto/results/all-less.latest.log",
    "state/codex-auto/runs/less-comments-selector-comment-trivia-20260422-141731/summary.json",
    "packages/core/src/tree/ruleset.ts:824",
    "packages/core/src/tree/at-rule.ts:266"
  ],
  "goal_refs": [
    "less parity recovery",
    "preserve selector-adjacent and at-rule-header comments through evaluation"
  ],
  "depends_on": [],
  "blocked_by": [],
  "definition_of_done": "A focused selector/header comment proof and the targeted comments.less outer proof both pass for the selector and at-rule-header surfaces, with accepted evidence linked.",
  "proof_expectations": [
    "focused parser/core proof for selector or at-rule-header comment retention through evaluation",
    "targeted less fixture proof for tests-unit/comments/comments.less",
    "promotion verification"
  ],
  "accepted_commit": null,
  "accepted_run_id": null,
  "last_transition_event_id": "operator:add:less-comments-selector-header-trivia:1776894173273"
}
