{
  "id": "less-color-functions-rgba",
  "title": "Fix Less parity for color functions / rgba",
  "track": "less-registry-redesign",
  "bucket": "less-fixture",
  "priority": "p1",
  "status": "completed",
  "source_refs": [
    "docs/future/performance/2026-04-13-registry-redesign-proposal.md",
    "packages/jess/test/less/all-less.test.ts",
    "tests-unit/color-functions/rgba.less",
    "state/codex-auto/results/all-less.latest.log"
  ],
  "goal_refs": [
    "less parity recovery"
  ],
  "depends_on": [],
  "blocked_by": [],
  "definition_of_done": "Focused proof and targeted outer proof both pass, and accepted evidence is linked.",
  "proof_expectations": [
    "targeted core or parser repro when applicable",
    "targeted less fixture proof",
    "promotion verification"
  ],
  "accepted_commit": "d7925f720d894eb9a9c40535afdc78ab75331b95",
  "accepted_run_id": "less-color-functions-rgba-20260422-122618",
  "last_transition_event_id": "operator:task-completed:less-color-functions-rgba:1776890400000"
}
