{
  "id": "less-comments-declaration-comment-spacing",
  "title": "Preserve declaration and custom-property comment spacing in comments.less",
  "track": "less-registry-redesign",
  "bucket": "less-fixture",
  "priority": "p1",
  "status": "open",
  "source_refs": [
    "tests-unit/comments/comments.less",
    "state/codex-auto/results/all-less.latest.log",
    "state/codex-auto/runs/less-comments-20260422-124515/summary.json",
    "docs/future/performance/2026-04-13-registry-redesign-handoff.md"
  ],
  "goal_refs": [
    "less parity recovery",
    "preserve declaration and custom-property comment-sensitive spacing after evaluation"
  ],
  "depends_on": [],
  "blocked_by": [],
  "definition_of_done": "A focused declaration/custom-property proof and the targeted comments.less outer proof both pass for comment-sensitive spacing, with accepted evidence linked.",
  "proof_expectations": [
    "focused core proof for declaration or custom-property comment spacing",
    "targeted less fixture proof for tests-unit/comments/comments.less",
    "promotion verification"
  ],
  "accepted_commit": null,
  "accepted_run_id": null,
  "last_transition_event_id": "operator:add:less-comments-declaration-comment-spacing:1776890324467"
}
